sourceCode,sourceName,sourceFrequency,sourceAutoAssignedConceptIds,matchScore,mappingStatus,equivalence,statusSetBy,statusSetOn,conceptId,conceptName,domainId,mappingType,comment,createdBy,createdOn,assignedReviewer
EPD_CLDT0000003816,Bipolar disorder (disorder). bipolaire affectieve stoornis,3,,1.0,APPROVED,EQUAL,etl,1645031057674,436665,Bipolar disorder,Condition,MAPS_TO,AUTO MAPPED,etl,1645031057674,
EPD_CLDT0000054154,lactic acidosis,3,,0.0,APPROVED,EQUAL,etl,1645031057674,4239233,Lactic acidosis,Condition,MAPS_TO,AUTO MAPPED,etl,1645031057674,
EPD_CLDT0000035930,zelfvergiftiging. autointoxicatie. Autointoxication (disorder),3,,1.0,APPROVED,EQUAL,etl,1645031057674,4267002,Autointoxication,Condition,MAPS_TO,AUTO MAPPED,etl,1645031057674,
EPD_CLDT0000001154,Malignant neoplasm of middle lobe. bronchus or lung (disorder). maligne neoplasma van middenkwab. bronchus of long. maligne tumor van middenkwab. bronchus of long,3,,1.0,APPROVED,EQUAL,etl,1645031057674,4092217,"Malignant neoplasm of middle lobe, bronchus or lung",Condition,MAPS_TO,AUTO MAPPED,etl,1645031057674,
EPD_CLDT0000005285,Cerebrovascular disease (disorder). cerebrovasculaire ziekte,3,,1.0,APPROVED,EQUAL,etl,1645031057674,381591,Cerebrovascular disease,Condition,MAPS_TO,AUTO MAPPED,etl,1645031057674,
EPD_CLDT0000037905,status na heupprothese,3,,0.0,APPROVED,EQUAL,etl,1645031057674,0,Unmapped,,MAPS_TO,AUTO MAPPED,etl,1645031057674,
EPD_CLDT0000011288,Anterior epistaxis (disorder). epistaxis locus Kiesselbachi. epistaxis anterior,3,,1.0,APPROVED,EQUAL,etl,1645031057674,4049224,Anterior epistaxis,Condition,MAPS_TO,AUTO MAPPED,etl,1645031057674,
EPD_CLDT0000013012,Infection of vascular prosthesis (disorder). geïnfecteerde vaatprothese. geïnfecteerde vaatprothese (geinfecteerde),3,,0.0,UNCHECKED,UNREVIEWED,etl,1645031057674,0,Unmapped,,MAPS_TO,AUTO MAPPED,etl,1645031057674,
EPD_CLDT0000009701,Isolated proteinuria with specified morphological lesion (finding). geïsoleerde proteïnurie,3,,1.0,APPROVED,EQUAL,etl,1645031057674,4056481,Isolated proteinuria with specified morphological lesion,Condition,MAPS_TO,AUTO MAPPED,etl,1645031057674,
EPD_CS01301898,CARA / COPD,3,,0.0,APPROVED,EQUAL,etl,1645031057674,255573,Chronic obstructive lung disease,Condition,MAPS_TO,AUTO MAPPED,etl,1645031057674,
EPD_CLDT0000040228,grootcellig neuro-endocrien longcarcinoom,3,,0.0,UNCHECKED,UNREVIEWED,etl,1645031057674,0,Unmapped,,MAPS_TO,AUTO MAPPED,etl,1645031057674,
EPD_CLDT0000011317,pleuritis. Pleurisy (disorder),3,,1.0,APPROVED,EQUAL,etl,1645031057674,78786,Pleurisy,Condition,MAPS_TO,AUTO MAPPED,etl,1645031057674,
EPD_CLDT0000009649,berger. IgA-nefropathie. Immunoglobulin A nephropathy (disorder),3,,1.0,APPROVED,EQUAL,etl,1645031057674,4128061,IgA nephropathy,Condition,MAPS_TO,AUTO MAPPED,etl,1645031057674,
EPD_CLDT0000005156,acute endocarditis. acute endocarditis. niet gespecificeerd. Acute endocarditis (disorder),3,,1.0,APPROVED,EQUAL,etl,1645031057674,434663,Acute endocarditis,Condition,MAPS_TO,AUTO MAPPED,etl,1645031057674,
EPD_CLDT0000060709,recidiverend vallen. Recurrent falls (finding),3,,1.0,APPROVED,EQUAL,etl,1645031057674,4087528,Recurrent falls,Condition,MAPS_TO,AUTO MAPPED,etl,1645031057674,
EPD_CLDT0000037887,status na operatie tumor cerebri,3,,0.0,UNCHECKED,UNREVIEWED,etl,1645031057674,0,Unmapped,,MAPS_TO,AUTO MAPPED,etl,1645031057674,
EPD_CLDT0000059560,cerebraal infarct door embolie in cerebrale arteriën. herseninfarct door embolie in hersenarteriën. Cerebral infarction due to embolism of cerebral arteries (disorder),3,,1.0,APPROVED,EQUAL,etl,1645031057674,4108356,Cerebral infarction due to embolism of cerebral arteries,Condition,MAPS_TO,AUTO MAPPED,etl,1645031057674,
EPD_CLDT0000059493,restverschijnselen na subarachnoïdale bloeding. gevolgen van subarachnoïdale bloeding. Sequelae of subarachnoid hemorrhage (disorder),3,,1.0,APPROVED,EQUAL,etl,1645031057674,4111720,Sequelae of subarachnoid hemorrhage,Condition,MAPS_TO,AUTO MAPPED,etl,1645031057674,
EPD_CLDT0000015700,longoperatie in anamnese,3,,0.0,UNCHECKED,UNREVIEWED,etl,1645031057674,0,Unmapped,,MAPS_TO,AUTO MAPPED,etl,1645031057674,
EPD_0000000308,VRE pos,3,,0.0,APPROVED,EQUAL,etl,1645031057674,4160574,Carrier of vancomycin resistant enterococcus,Condition,MAPS_TO,AUTO MAPPED,etl,1645031057674,
EPD_CLDT0000058330,Supratentorial intra-axial neoplasm (disorder). supratentoriele intra-axiale tumor,2,,0.0,UNCHECKED,UNREVIEWED,etl,1645031057674,0,Unmapped,,MAPS_TO,AUTO MAPPED,etl,1645031057674,
EPD_CLDT0000003818,Moderate major depression. single episode (disorder). matige depressieve episode,2,,1.0,APPROVED,EQUAL,etl,1645031057674,4049623,"Moderate major depression, single episode",Condition,MAPS_TO,AUTO MAPPED,etl,1645031057674,
EPD_CLDT0000006190,Angiodysplasia of colon (disorder). angiodysplasie van colon,2,,1.0,APPROVED,EQUAL,etl,1645031057674,4055201,Angiodysplasia of colon,Condition,MAPS_TO,AUTO MAPPED,etl,1645031057674,
EPD_CLDT0000051084,tenosynovitis. tenosynoviitis,2,,0.0,APPROVED,EQUAL,etl,1645031057674,4195698,Tenosynovitis,Condition,MAPS_TO,AUTO MAPPED,etl,1645031057674,
EPD_CLDT0000001556,folliculair non-Hodgkin-lymfoom. Follicular non-Hodgkin's lymphoma (disorder),2,,1.0,APPROVED,EQUAL,etl,1645031057674,4147411,Follicular non-Hodgkin's lymphoma,Condition,MAPS_TO,AUTO MAPPED,etl,1645031057674,
EPD_CLDT0000062206,Contusion of rib (disorder). contusie van rib,2,,1.0,APPROVED,EQUAL,etl,1645031057674,4175861,Contusion of rib,Condition,MAPS_TO,AUTO MAPPED,etl,1645031057674,
EPD_CLDT0000003339,gemengde hyperlipidemie. Mixed hyperlipidemia (disorder),2,,1.0,APPROVED,EQUAL,etl,1645031057674,438720,Mixed hyperlipidemia,Condition,MAPS_TO,AUTO MAPPED,etl,1645031057674,
EPD_CLDT0000051965,chronisch obstructief astma,2,,0.0,APPROVED,EQUAL,etl,1645031057674,256448,Chronic asthmatic bronchitis,Condition,MAPS_TO,AUTO MAPPED,etl,1645031057674,
EPD_CLDT0000061806,hematoom in spier. Intramuscular hematoma (disorder),2,,1.0,APPROVED,EQUAL,etl,1645031057674,4136550,Intramuscular hematoma,Condition,MAPS_TO,AUTO MAPPED,etl,1645031057674,
EPD_CLDT0000013425,History of laryngectomy (situation). status na laryngectomie,2,,1.0,APPROVED,EQUAL,etl,1645031057674,4323764,History of laryngectomy,Observation,MAPS_TO,AUTO MAPPED,etl,1645031057674,
EPD_CLDT0000039114,pericardtamponade. Cardiac tamponade (disorder),2,,1.0,APPROVED,EQUAL,etl,1645031057674,318450,Cardiac tamponade,Condition,MAPS_TO,AUTO MAPPED,etl,1645031057674,
EPD_CLDT0000015483,dysfasie. Dysphasia (finding),2,,1.0,APPROVED,EQUAL,etl,1645031057674,441594,Dysphasia,Condition,MAPS_TO,AUTO MAPPED,etl,1645031057674,
EPD_CLDT0000015730,History of epilepsy (situation). epilepsie in anamnese,2,,1.0,APPROVED,EQUAL,etl,1645031057674,4058283,H/O: epilepsy,Observation,MAPS_TO,AUTO MAPPED,etl,1645031057674,
EPD_CLDT0000003668,organische psychische stoornis. Organic mental disorder (disorder),2,,1.0,APPROVED,EQUAL,etl,1645031057674,374009,Organic mental disorder,Condition,MAPS_TO,AUTO MAPPED,etl,1645031057674,
EPD_CLDT0000011422,somnolentie. Drowsiness. function (observable entity),2,,1.0,APPROVED,EQUAL,etl,1645031057674,4196193,Drowsiness,Observation,MAPS_TO,AUTO MAPPED,etl,1645031057674,
EPD_CLDT0000004550,troebeling van cornea. Corneal opacity (disorder),2,,1.0,APPROVED,EQUAL,etl,1645031057674,378752,Corneal opacity,Condition,MAPS_TO,AUTO MAPPED,etl,1645031057674,
EPD_CLDT0000005250,cerebellaire bloeding. Cerebellar hemorrhage (disorder),2,,1.0,APPROVED,EQUAL,etl,1645031057674,4326561,Cerebellar hemorrhage,Condition,MAPS_TO,AUTO MAPPED,etl,1645031057674,
EPD_CLDT0000052200,bloeding van colon. Hemorrhage of colon (disorder),2,,1.0,APPROVED,EQUAL,etl,1645031057674,442190,Hemorrhage of colon,Condition,MAPS_TO,AUTO MAPPED,etl,1645031057674,
EPD_CLDT0000058221,Sepsis caused by fungus (disorder). schimmelsepsis,2,,1.0,APPROVED,EQUAL,etl,1645031057674,44784138,Sepsis due to fungus,Condition,MAPS_TO,AUTO MAPPED,etl,1645031057674,
EPD_CLDT0000009878,Disorder of prostate (disorder). aandoening van prostaat,2,,1.0,APPROVED,EQUAL,etl,1645031057674,196734,Disorder of prostate,Condition,MAPS_TO,AUTO MAPPED,etl,1645031057674,
EPD_CLDT0000051190,botmetastase in thoracale wervelkolom met neurologische uitval. Secondary malignant neoplasm of thoracic vertebral column with neuropathy (disorder),2,,0.0,APPROVED,EQUAL,etl,1645031057674,4247948,Secondary malignant neoplasm of thoracic vertebral column,Condition,MAPS_TO,AUTO MAPPED,etl,1645031057674,
EPD_CLDT0000011338,globusgevoel. Globus sensation (finding),2,,1.0,APPROVED,EQUAL,etl,1645031057674,4145818,Feeling of lump in throat,Condition,MAPS_TO,AUTO MAPPED,etl,1645031057674,
EPD_CLDT0000011534,gelokaliseerd oedeem. Localized edema (finding),2,,1.0,APPROVED,EQUAL,etl,1645031057674,4171917,Localized edema,Condition,MAPS_TO,AUTO MAPPED,etl,1645031057674,
EPD_CLDT0000001457,folliculair schildkliercarcinoom. Follicular thyroid carcinoma (disorder),2,,1.0,APPROVED,EQUAL,etl,1645031057674,4111010,Follicular thyroid carcinoma,Condition,MAPS_TO,AUTO MAPPED,etl,1645031057674,
EPD_CLDT0000050655,Tumor lysis syndrome (disorder). tumorlysis syndroom,2,,1.0,APPROVED,EQUAL,etl,1645031057674,4079687,Tumor lysis syndrome,Condition,MAPS_TO,AUTO MAPPED,etl,1645031057674,
EPD_CLDT0000005290,laat gevolg van cerebrovasculair accident (CVA). laat gevolg van beroerte,2,,0.0,APPROVED,EQUAL,etl,1645031057674,43530623,Sequela of cerebrovascular accident,Condition,MAPS_TO,AUTO MAPPED,etl,1645031057674,
EPD_CLDT0000002736,diabetische voet. Diabetic foot (disorder),2,,1.0,APPROVED,EQUAL,etl,1645031057674,4087682,Diabetic foot,Condition,MAPS_TO,AUTO MAPPED,etl,1645031057674,
EPD_CLDT0000013089,infectie en ontstekingsreactie als gevolg van inwendige orthopedische prothese. implantaat of transplantaat. infectie en ontstekingsreactie als gevolg van inwendige orthopedische prothesen. implantaten en transplantaten,2,,0.0,UNCHECKED,UNREVIEWED,etl,1645031057674,0,Unmapped,,MAPS_TO,AUTO MAPPED,etl,1645031057674,
EPD_CLDT0000001422,maligne melanoom van choroidea. Malignant melanoma of choroid (disorder),2,,1.0,APPROVED,EQUAL,etl,1645031057674,4116224,Malignant melanoma of choroid,Condition,MAPS_TO,AUTO MAPPED,etl,1645031057674,
EPD_CLDT0000053437,small cell cancer of lung,2,,0.0,APPROVED,EQUAL,etl,1645031057674,4110591,Small cell carcinoma of lung,Condition,MAPS_TO,AUTO MAPPED,etl,1645031057674,
EPD_CLDT0000050493,Pancoast tumor (disorder). Pancoast-tumor,2,,1.0,APPROVED,EQUAL,etl,1645031057674,4110706,Pancoast tumor,Condition,MAPS_TO,AUTO MAPPED,etl,1645031057674,
EPD_CLDT0000001938,Epidermal nevus (disorder). epidermale naevus,2,,1.0,APPROVED,EQUAL,etl,1645031057674,4343223,Epidermal nevus,Condition,MAPS_TO,AUTO MAPPED,etl,1645031057674,
EPD_CLDT0000037880,status na operatie hersenaandoening. History of brain surgery (situation),2,,0.0,UNCHECKED,UNREVIEWED,etl,1645031057674,0,Unmapped,,MAPS_TO,AUTO MAPPED,etl,1645031057674,
EPD_CLDT0000057710,Arthritis of hallux (disorder). artritis van hallux,2,,0.0,UNCHECKED,UNREVIEWED,etl,1645031057674,0,Unmapped,,MAPS_TO,AUTO MAPPED,etl,1645031057674,
EPD_CLDT0000011292,Hemoptysis (disorder). hemoptoë,2,,0.0,APPROVED,EQUAL,etl,1645031057674,261687,Hemoptysis,Condition,MAPS_TO,AUTO MAPPED,etl,1645031057674,
EPD_CLDT0000037641,fractuur van enkel. Fracture of ankle (disorder),2,,1.0,APPROVED,EQUAL,etl,1645031057674,4059173,Fracture of ankle,Condition,MAPS_TO,AUTO MAPPED,etl,1645031057674,
EPD_CLDT0000003363,Hyperuricemia (disorder). hyperurikemie,2,,1.0,APPROVED,EQUAL,etl,1645031057674,4147761,Hyperuricemia,Condition,MAPS_TO,AUTO MAPPED,etl,1645031057674,
EPD_CLDT0000001681,therapie-gerelateerde myeloïde neoplasmata. therapy-related myeloid neoplasms,2,,0.0,UNCHECKED,UNREVIEWED,etl,1645031057674,0,Unmapped,,MAPS_TO,AUTO MAPPED,etl,1645031057674,
EPD_CLDT0000058211,Hypertriglyceridemia (disorder). hypertriglyceridemie,2,,1.0,APPROVED,EQUAL,etl,1645031057674,4120314,Hypertriglyceridemia,Condition,MAPS_TO,AUTO MAPPED,etl,1645031057674,
EPD_CLDT0000011525,intrathoracale lymfadenopathie. Thoracic lymphadenopathy (disorder),2,,1.0,APPROVED,EQUAL,etl,1645031057674,4131138,Thoracic lymphadenopathy,Condition,MAPS_TO,AUTO MAPPED,etl,1645031057674,
EPD_CLDT0000005555,Peripheral venous insufficiency (disorder). perifeer veneuze insufficiëntie,2,,1.0,APPROVED,EQUAL,etl,1645031057674,321596,Peripheral venous insufficiency,Condition,MAPS_TO,AUTO MAPPED,etl,1645031057674,
EPD_CLDT0000051189,botmetastase in thoracale wervelkolom. Secondary malignant neoplasm of thoracic vertebral column (disorder),2,,1.0,APPROVED,EQUAL,etl,1645031057674,4247948,Secondary malignant neoplasm of thoracic vertebral column,Condition,MAPS_TO,AUTO MAPPED,etl,1645031057674,
EPD_CLDT0000050645,Thrombosis of iliac artery (disorder). trombose van arteria iliaca,2,,1.0,APPROVED,EQUAL,etl,1645031057674,444264,Thrombosis of iliac artery,Condition,MAPS_TO,AUTO MAPPED,etl,1645031057674,
EPD_CLDT0000002241,Aplastic anemia due to drugs (disorder). medicatie-geïnduceerde aplastische anemie,2,,1.0,APPROVED,EQUAL,etl,1645031057674,4146088,Aplastic anemia due to drugs,Condition,MAPS_TO,AUTO MAPPED,etl,1645031057674,
EPD_CLDT0000007286,artrose van schouder. Degenerative joint disease of shoulder region (disorder),2,,1.0,APPROVED,EQUAL,etl,1645031057674,72405,Degenerative joint disease of shoulder region,Condition,MAPS_TO,AUTO MAPPED,etl,1645031057674,
EPD_CLDT0000058335,infratentoriele intra-axiale tumor. Infratentorial intra-axial neoplasm (disorder),2,,0.0,UNCHECKED,UNREVIEWED,etl,1645031057674,0,Unmapped,,MAPS_TO,AUTO MAPPED,etl,1645031057674,
EPD_CLDT0000039094,Dyslipidemia (disorder). dyslipidemie,2,,1.0,APPROVED,EQUAL,etl,1645031057674,4159131,Dyslipidemia,Condition,MAPS_TO,AUTO MAPPED,etl,1645031057674,
EPD_CLDT0000008631,Rotator cuff syndrome (disorder). rotator cuff syndrome,2,,1.0,APPROVED,EQUAL,etl,1645031057674,4164922,Rotator cuff syndrome,Condition,MAPS_TO,AUTO MAPPED,etl,1645031057674,
EPD_CLDT0000038863,pseudo-epitheliomateuze hyperplasie. Pseudoepitheliomatous hyperplasia (disorder),2,,1.0,APPROVED,EQUAL,etl,1645031057674,4112747,Pseudoepitheliomatous hyperplasia,Condition,MAPS_TO,AUTO MAPPED,etl,1645031057674,
EPD_CLDT0000051327,ruptuur van extensorpees van hand. Rupture of extensor tendon of hand (disorder),2,,1.0,APPROVED,EQUAL,etl,1645031057674,3654831,Rupture of extensor tendon of hand,Condition,MAPS_TO,AUTO MAPPED,etl,1645031057674,
EPD_CS01301581,Maligne neoplasma van oesophagus (Oesophaguscarcinoom),2,,0.0,APPROVED,EQUAL,etl,1645031057674,4181343,Malignant tumor of esophagus,Condition,MAPS_TO,AUTO MAPPED,etl,1645031057674,
EPD_CLDT0000039162,Ventricular premature beats (disorder). ventriculaire extrasystolie,2,,1.0,APPROVED,EQUAL,etl,1645031057674,4066289,Ventricular premature beats,Condition,MAPS_TO,AUTO MAPPED,etl,1645031057674,
EPD_CLDT0000035793,impingement van enkel. Impingement syndrome of ankle (disorder),2,,1.0,APPROVED,EQUAL,etl,1645031057674,4347175,Impingement syndrome of ankle,Condition,MAPS_TO,AUTO MAPPED,etl,1645031057674,
EPD_CLDT0000002234,Acquired hemolytic anemia (disorder). verworven hemolytische anemie,2,,1.0,APPROVED,EQUAL,etl,1645031057674,440979,Acquired hemolytic anemia,Condition,MAPS_TO,AUTO MAPPED,etl,1645031057674,
EPD_CLDT0000006258,Retroperitoneal abscess (disorder). retroperitoneaal abces,2,,1.0,APPROVED,EQUAL,etl,1645031057674,200761,Retroperitoneal abscess,Condition,MAPS_TO,AUTO MAPPED,etl,1645031057674,
EPD_CLDT0000005785,allergisch astma,2,,0.0,APPROVED,EQUAL,etl,1645031057674,4191479,Allergic asthma,Condition,MAPS_TO,AUTO MAPPED,etl,1645031057674,
EPD_CLDT0000004729,degeneratie van macula en achterste pool. Degeneration of macula and posterior pole (disorder),2,,1.0,APPROVED,EQUAL,etl,1645031057674,4146103,Degeneration of macula and posterior pole,Condition,MAPS_TO,AUTO MAPPED,etl,1645031057674,
EPD_0000000287,Respiratoire syncytial virus (RSV) infectie bij baby’s. kleine kinderen en immuungecompromitteerde volwassenen,2,,0.0,APPROVED,EQUAL,etl,1645031057674,437222,Respiratory syncytial virus infection,Condition,MAPS_TO,AUTO MAPPED,etl,1645031057674,
EPD_0000000301,Tuberculose (Mycobacterium tuberculosis): Pulmonair of laryngeaal. bevestigd of vermoeden van,2,,0.0,UNCHECKED,UNREVIEWED,etl,1645031057674,0,Unmapped,,MAPS_TO,AUTO MAPPED,etl,1645031057674,
EPD_CS01302063,Chronische nierinsufficientie,2,,0.0,APPROVED,EQUAL,etl,1645031057674,36716947,Chronic renal insufficiency,Condition,MAPS_TO,AUTO MAPPED,etl,1645031057674,
EPD_CLDT0000039058,afwijking van aortaklep. Abnormality of aortic valve (disorder),2,,1.0,APPROVED,EQUAL,etl,1645031057674,40491478,Abnormality of aortic valve,Condition,MAPS_TO,AUTO MAPPED,etl,1645031057674,
EPD_CLDT0000006881,Rheumatoid arthritis. seropositive and anti-cyclic citrullinated peptide negative (disorder). reumafactor-positieve en antiCCP-negatieve reumatoïde artritis,2,,0.0,APPROVED,EQUAL,etl,1645031057674,4035611,Seropositive rheumatoid arthritis,Condition,MAPS_TO,AUTO MAPPED,etl,1645031057674,
EPD_CLDT0000005857,verworven misvorming van trachea en bronchus. Acquired deformity of trachea and bronchus (disorder),2,,0.0,UNCHECKED,UNREVIEWED,etl,1645031057674,0,Unmapped,,MAPS_TO,AUTO MAPPED,etl,1645031057674,
EPD_CLDT0000038810,perianale fistel. Perianal fistula (disorder),2,,1.0,APPROVED,EQUAL,etl,1645031057674,4241349,Perianal fistula,Condition,MAPS_TO,AUTO MAPPED,etl,1645031057674,
EPD_CLDT0000005276,Dissection of cerebral artery (disorder). dissectie van cerebrale arterie,2,,1.0,APPROVED,EQUAL,etl,1645031057674,37016924,Dissection of cerebral artery,Condition,MAPS_TO,AUTO MAPPED,etl,1645031057674,
EPD_CLDT0000011402,neiging tot vallen. At risk for falls (finding),2,,1.0,APPROVED,EQUAL,etl,1645031057674,4032527,At risk for falls,Condition,MAPS_TO,AUTO MAPPED,etl,1645031057674,
EPD_CS01485676,Psychologisch,2,,0.0,APPROVED,EQUAL,etl,1645031057674,4023059,Psychological finding,Condition,MAPS_TO,AUTO MAPPED,etl,1645031057674,
EPD_CLDT0000052464,Thrombosis of superior vena cava (disorder). trombose van vena cava superior,2,,1.0,APPROVED,EQUAL,etl,1645031057674,4084941,Thrombosis of superior vena cava,Condition,MAPS_TO,AUTO MAPPED,etl,1645031057674,
EPD_CLDT0000005325,aneurysma van arteria poplitea. Aneurysm of popliteal artery (disorder),2,,1.0,APPROVED,EQUAL,etl,1645031057674,4167993,Aneurysm of popliteal artery,Condition,MAPS_TO,AUTO MAPPED,etl,1645031057674,
EPD_CLDT0000005864,mediastinitis. Mediastinitis (disorder),2,,1.0,APPROVED,EQUAL,etl,1645031057674,4189294,Inflammatory disorder of mediastinum,Condition,MAPS_TO,AUTO MAPPED,etl,1645031057674,
EPD_CLDT0000051004,necrose van weke delen. Necrosis of soft tissues (disorder),2,,0.0,UNCHECKED,UNREVIEWED,etl,1645031057674,0,Unmapped,,MAPS_TO,AUTO MAPPED,etl,1645031057674,
EPD_CLDT0000000173,Staphylococcus aureus sepsis,2,,0.0,APPROVED,EQUAL,etl,1645031057674,40489907,Sepsis due to Staphylococcus aureus,Condition,MAPS_TO,AUTO MAPPED,etl,1645031057674,
EPD_CLDT0000039050,afwijking van rechter ventrikel. Right ventricular abnormality (disorder),2,,1.0,APPROVED,EQUAL,etl,1645031057674,4101621,Right ventricular abnormality,Condition,MAPS_TO,AUTO MAPPED,etl,1645031057674,
EPD_CS01498131,Lumbalgie,2,,0.0,APPROVED,EQUAL,etl,1645031057674,194133,Low back pain,Condition,MAPS_TO,AUTO MAPPED,etl,1645031057674,
EPD_CLDT0000051912,diverticulair abces. Colonic diverticular abscess (disorder),2,,1.0,APPROVED,EQUAL,etl,1645031057674,4342753,Abscess with diverticular disease of colon,Condition,MAPS_TO,AUTO MAPPED,etl,1645031057674,
EPD_CLDT0000012969,transfusie reactie. complicatie na infusie. transfusie en/of therapeutische injectie,2,,0.0,UNCHECKED,UNREVIEWED,etl,1645031057674,0,Unmapped,,MAPS_TO,AUTO MAPPED,etl,1645031057674,
EPD_CS01485708,Decubitus,2,,0.0,UNCHECKED,UNREVIEWED,etl,1645031057674,0,Unmapped,,MAPS_TO,AUTO MAPPED,etl,1645031057674,
EPD_CLDT0000051918,maagretentie. Gastric retention (disorder),2,,1.0,APPROVED,EQUAL,etl,1645031057674,4143869,Gastric retention,Condition,MAPS_TO,AUTO MAPPED,etl,1645031057674,
EPD_CLDT0000003819,ernstige depressieve episode. Severe major depression. single episode. without psychotic features (disorder),2,,1.0,APPROVED,EQUAL,etl,1645031057674,441534,"Severe major depression, single episode, without psychotic features",Condition,MAPS_TO,AUTO MAPPED,etl,1645031057674,
EPD_CLDT0000006104,obstructie van duodenum. Obstruction of duodenum (disorder),2,,1.0,APPROVED,EQUAL,etl,1645031057674,434085,Obstruction of duodenum,Condition,MAPS_TO,AUTO MAPPED,etl,1645031057674,
EPD_CLDT0000005125,Coronary thrombosis not resulting in myocardial infarction (disorder). coronaire trombose niet leidend tot myocardinfarct,2,,1.0,APPROVED,EQUAL,etl,1645031057674,4108215,Coronary thrombosis not resulting in myocardial infarction,Condition,MAPS_TO,AUTO MAPPED,etl,1645031057674,
EPD_CLDT0000062475,plaveiselcelcarcinoom in orofarynx. Primary squamous cell carcinoma of oropharynx (disorder),2,,1.0,APPROVED,EQUAL,etl,1645031057674,45769026,Primary squamous cell carcinoma of oropharynx,Condition,MAPS_TO,AUTO MAPPED,etl,1645031057674,
EPD_CLDT0000038185,huidabces van romp. Abscess of trunk (disorder),2,,1.0,APPROVED,EQUAL,etl,1645031057674,4176868,Abscess of trunk,Condition,MAPS_TO,AUTO MAPPED,etl,1645031057674,
EPD_CLDT0000050342,infectie van gewrichtsprothese. Prosthetic joint infection (disorder),2,,1.0,APPROVED,EQUAL,etl,1645031057674,4308690,Prosthetic joint infection,Condition,MAPS_TO,AUTO MAPPED,etl,1645031057674,
EPD_CLDT0000050424,mechanische ileus. Mechanical ileus (disorder),2,,1.0,APPROVED,EQUAL,etl,1645031057674,4188043,Mechanical ileus,Condition,MAPS_TO,AUTO MAPPED,etl,1645031057674,
EPD_CLDT0000059925,gedaald bewustzijn. Decreased level of consciousness (finding),2,,1.0,APPROVED,EQUAL,etl,1645031057674,40481424,Decreased level of consciousness,Condition,MAPS_TO,AUTO MAPPED,etl,1645031057674,
EPD_CLDT0000035799,Atopic constitution as co-factor (disorder). atopische constitutie,2,,1.0,APPROVED,EQUAL,etl,1645031057674,4019380,Atopy,Condition,MAPS_TO,AUTO MAPPED,etl,1645031057674,
EPD_CLDT0000036289,Ischemic colitis (disorder). ischemische colitis,2,,1.0,APPROVED,EQUAL,etl,1645031057674,4148299,Ischemic colitis,Condition,MAPS_TO,AUTO MAPPED,etl,1645031057674,
EPD_CLDT0000040035,carotisendarterectomie (CEA) @DBC,2,,0.0,APPROVED,EQUAL,etl,1645031057674,0,Unmapped,,MAPS_TO,AUTO MAPPED,etl,1645031057674,
EPD_CLDT0000050209,Ketoacidosis in diabetes mellitus (disorder). diabetische ketoacidose,2,,0.0,APPROVED,EQUAL,etl,1645031057674,443727,Diabetic ketoacidosis,Condition,MAPS_TO,AUTO MAPPED,etl,1645031057674,
EPD_CLDT0000050404,luxatie van heupprothese. Dislocation of hip joint prosthesis (disorder),2,,1.0,APPROVED,EQUAL,etl,1645031057674,4199185,Dislocation of hip joint prosthesis,Condition,MAPS_TO,AUTO MAPPED,etl,1645031057674,
EPD_CLDT0000004876,Strabismus (disorder). strabismus,2,,1.0,APPROVED,EQUAL,etl,1645031057674,4329707,Strabismus,Condition,MAPS_TO,AUTO MAPPED,etl,1645031057674,
EPD_CLDT0000005164,Aortic valve disorder (disorder). aandoening van aortaklep,2,,1.0,APPROVED,EQUAL,etl,1645031057674,314054,Aortic valve disorder,Condition,MAPS_TO,AUTO MAPPED,etl,1645031057674,
EPD_0000000309,VRE risk,2,,0.0,APPROVED,EQUAL,etl,1645031057674,0,Unmapped,,MAPS_TO,AUTO MAPPED,etl,1645031057674,
EPD_CLDT0000005101,Acute hypertensive renal failure (disorder). acute hypertensieve nierinsufficiëntie,2,,0.0,APPROVED,EQUAL,etl,1645031057674,443919,Hypertensive renal failure,Condition,MAPS_TO,AUTO MAPPED,etl,1645031057674,
EPD_CS01441461,Longembolie met vermelding van acuut cor pulmonale,2,,0.0,APPROVED,EQUAL,etl,1645031057674,312927,Acute cor pulmonale,Condition,MAPS_TO,AUTO MAPPED,etl,1645031057674,
EPD_CS01441461,Longembolie met vermelding van acuut cor pulmonale,2,,0.0,APPROVED,EQUAL,etl,1645031057674,440417,Pulmonary embolism,Condition,MAPS_TO,AUTO MAPPED,etl,1645031057674,
EPD_CLDT0000007724,fistel van gewricht. elleboog. Fistula of elbow joint (disorder),2,,1.0,APPROVED,EQUAL,etl,1645031057674,4139063,Fistula of elbow joint,Condition,MAPS_TO,AUTO MAPPED,etl,1645031057674,
EPD_CLDT0000052119,Subdural intracranial hematoma (disorder). subduraal hematoom,2,,1.0,APPROVED,EQUAL,etl,1645031057674,4318408,Subdural hematoma,Condition,MAPS_TO,AUTO MAPPED,etl,1645031057674,
EPD_CLDT0000015505,Suspected epilepsy (situation). verdenking op epilepsie,2,,1.0,APPROVED,EQUAL,etl,1645031057674,4250012,Suspected epilepsy,Observation,MAPS_TO,AUTO MAPPED,etl,1645031057674,
EPD_CLDT0000062001,nierinsufficiëntie waarvoor chronische hemodialyse in instelling,2,,0.0,APPROVED,EQUAL,etl,1645031057674,4030520,End stage renal failure on dialysis,Condition,MAPS_TO,AUTO MAPPED,etl,1645031057674,
EPD_CLDT0000040141,Complicated diverticular disease (disorder). diverticulitis met complicatie,2,,0.0,APPROVED,EQUAL,etl,1645031057674,4155076,Complicated diverticular disease of large intestine,Condition,MAPS_TO,AUTO MAPPED,etl,1645031057674,
EPD_CLDT0000005046,Ototoxicity - deafness (disorder). ototoxisch perceptief gehoorverlies,2,,1.0,APPROVED,EQUAL,etl,1645031057674,4150172,Ototoxicity - deafness,Condition,MAPS_TO,AUTO MAPPED,etl,1645031057674,
EPD_CLDT0000000573,aspergillose. Aspergillosis (disorder),2,,1.0,APPROVED,EQUAL,etl,1645031057674,434281,Aspergillosis,Condition,MAPS_TO,AUTO MAPPED,etl,1645031057674,
EPD_CLDT0000051975,Brittle asthma (disorder). moeilijk behandelbaar astma,2,,1.0,APPROVED,EQUAL,etl,1645031057674,4075237,Brittle asthma,Condition,MAPS_TO,AUTO MAPPED,etl,1645031057674,
EPD_CLDT0000005324,aneurysma van arteria femoralis. Aneurysm of femoral artery (disorder),2,,1.0,APPROVED,EQUAL,etl,1645031057674,4239400,Aneurysm of femoral artery,Condition,MAPS_TO,AUTO MAPPED,etl,1645031057674,
EPD_CLDT0000058881,cochleair gehoorverlies. Sensory hearing loss (disorder),2,,1.0,APPROVED,EQUAL,etl,1645031057674,444291,Sensory hearing loss,Condition,MAPS_TO,AUTO MAPPED,etl,1645031057674,
